{
  "schema_version": "nova-generator-editorial-suggestions/1.3",
  "scene_id": "11111111-1111-4111-8111-111111111111",
  "input_sha256": "aaaaaaaaaaaaaaaaaaaaaaaaaaaaaaaaaaaaaaaaaaaaaaaaaaaaaaaaaaaaaaaa",
  "suggestions": [
    {
      "cue_id": "cue-1",
      "order": 1,
      "approved_en": "“Can I help?”",
      "approved_pt": "“Posso ajudar?”",
      "notes": "Expressão tratada como unidade.",
      "word_translations": [
        {"word_id": "word-1", "order": 1, "leading": "“", "surface": "Can", "start_ms": 100, "end_ms": 300, "pt": "posso"},
        {"word_id": "word-2", "order": 2, "leading": " ", "surface": "I", "start_ms": 320, "end_ms": 400, "pt": "eu"},
        {"word_id": "word-3", "order": 3, "leading": " ", "surface": "help?", "start_ms": 420, "end_ms": 800, "pt": "ajudar?"}
      ],
      "semantic_units": [{"word_ids": ["word-1", "word-2", "word-3"], "pt": "Posso ajudar?"}],
      "trailing": "”"
    }
  ]
}
